Category,Content
Medicine,"Today, the World Health Organization (WHO) published its first-ever position paper on immunization products to protect infants against respiratory syncytial virus (RSV) – the leading cause of acute lower respiratory infections in children globally.

Every year, RSV causes about 100 000 deaths and over 3.6 million hospitalizations in children under the age of 5 years worldwide. About half of these deaths occur in infants younger than 6 months of age. The vast majority (97%) of RSV deaths in infants occur in low- and middle-income countries where there is limited access to supportive medical care, such as oxygen or hydration.

Published in the Weekly Epidemiological Record (WER), the position paper outlines WHO recommendations for two immunization products: a maternal vaccine that can be given to pregnant women in their third trimester to protect their infant and a long-acting monoclonal antibody that can be administered to infants from birth, just before or during the RSV season.

RSV usually causes mild symptoms similar to the common cold, including runny nose, cough and fever. However, it can lead to serious complications – including pneumonia and bronchiolitis – in infants, young children, older adults and those with compromised immune systems or underlying health conditions.

In response to the global burden of severe RSV disease among infants, WHO recommends that all countries introduce either the maternal vaccine, RSVpreF, or the monoclonal antibody, nirsevimab depending on the feasibility of implementation within each country's existing health system, cost-effectiveness and anticipated coverage. Both products were recommended by the Strategic Advisory Group of Experts on Immunization (SAGE) for global implementation in September 2024. In addition, the maternal vaccine received WHO prequalification in March 2025, allowing it to be purchased by UN agencies.

WHO recommends that the maternal vaccine be given to pregnant women during the third trimester of pregnancy, from week 28 onwards, to optimize for the adequate transfer of antibodies to their baby. The vaccine may be given during routine antenatal care, including at one of the 5 WHO-recommended antenatal care visits in the third trimester or any additional medical consultations.

The second WHO-recommended immunization product, nirsevimab, is given as a single injection of monoclonal antibodies that starts protecting babies against RSV within a week of administration and lasts for at least 5 months, which can cover the entire RSV season in countries with RSV seasonality.

WHO recommends that infants receive a single dose of nirsevimab right after birth or before being discharged from a birthing facility. If not administered at birth, the monoclonal antibody can be given during the baby's first health visit. If a country decides to administer the product only during the RSV season rather than year-round, a single dose can also be given to older infants just before entering their first RSV season.

The greatest impact on severe RSV disease will be achieved by administering the monoclonal antibody to infants under 6 months of age. However, there is still a potential benefit among infants up to 12 months of age.

WHO regularly issues updated position papers on vaccines, combinations of vaccines and other immunization products against diseases that have major public health impact. These papers focus primarily on the use of vaccines in large-scale vaccination programmes. The new position paper aims to inform national public health policymakers and immunization programme managers on the use of RSV immunization products in their national programmes, as well as national and international funding agencies."
Medicine,"On World No Tobacco Day, the World Health Organization (WHO) today launches a new publication and calls on governments to urgently ban all flavors in tobacco and nicotine products, including cigarettes, pouches, hookahs and e-cigarettes, to protect youth from addiction and disease.

Flavors like menthol, bubble gum and cotton candy are masking the harshness of tobacco and nicotine products turning toxic products into youth-friendly bait. Flavors not only make it harder to quit but have also been linked to serious lung diseases. Cigarettes, which still kill up to half of their users, also come in flavours or can have flavors added to them.

The publication, Flavor accessories in tobacco products enhance attractiveness and appeal, reveals how flavors and accessories like capsule filters and click-on drops are marketed to bypass regulations and hook new users.

Currently:

Countries such as Belgium, Denmark, and Lithuania are taking action, and WHO urges others to follow.

Flavors are a leading reason why young people try tobacco and nicotine products. Paired with flashy packaging and social media-driven marketing, they've increased the appeal of nicotine pouches, heated tobacco, and disposable vapes into addictive and harmful products, which aggressively target young people.

""We are watching a generation get hooked on nicotine through gummy bear-flavored pouches and rainbow-coloured vapes,"" said Dr Rüdiger Krech, WHO Director of Health Promotion. ""This isn't innovation, it's manipulation. And we must stop it.""

WHO reiterates that tobacco products, including heated tobacco products, expose users to cancer-causing chemicals and should be strictly regulated.

The 2025 World No Tobacco Day campaign honours governments, youth activists and civil society leaders pushing back against industry interference. ""Your actions are changing policy and saving lives,"" said Dr Krech.

With around 8 million tobacco-related deaths each year, the time for action is now. Flavors, and the industries that deploy them, have no place in a healthy future."
Medicine,"A new study by investigators from Mass General Brigham showed that a new app they created can help improve the quality of life for caregivers of patients undergoing bone marrow transplant (BMT). The researchers conducted a randomized clinical trial and found that caregivers assigned to use the app showed significantly greater improvements in quality of life, burden, and mood symptoms compared to those who did not have the app. They detailed their findings in a presentation at the American Society of Clinical Oncology annual meeting and a paper simultaneously published in theJournal of Clinical Oncology.

Jacobs co-developed the app with Areej El-Jawahri, MD, co-director of the Cancer Outcomes Research and Education Program and director of the Bone Marrow Transplant Survivorship Program at MGH. Together, they created a one-on-one supportive counseling program called BMT-CARE, which they had previously shown can increase caregiver quality of life. But to better scale the strategy, they created a virtual version of the therapy as an app called the BMT-CARE App.

The app offers educational modules, games, and videos grounded in evidence-based psychological techniques that support the caregiver through each stage of the process - before, during, and after the transplant. The trial testing of the app included 125 caregivers, half of whom received the app in addition to the usual supportive care services. The caregivers spent a median of 146.9 minutes using the app. Compared to those who received only standard services, the group using the app had a higher quality of life, lower caregiving burden, and fewer symptoms of depression and PTSD at 60 days after transplant.

""The BMT-CARE App may be an accessible option for much-needed support for overwhelmed caregivers who don't have the time, money or energy to access mental health services,"" said Jacobs.

The researchers are expanding the testing of the BMT-CARE App across multiple centers and with diverse caregiver populations."
Medicine,"The University of Pittsburgh's Natasa Miskov-Zivanov, assistant professor of electrical and computer engineering, has received a prestigious Faculty Early Career Development (CAREER) Award of $581,503 from the National Science Foundation (NSF) for her project titled ""Artificial Intelligence-Driven Framework for Efficient and Explainable Immunotherapy Design."" Through her novel approach and the development of an automated system that leverages AI and knowledge graphs to design more effective lymphocytes, she hopes to transform the design of life-saving immunotherapies.

Chimericantigenreceptor (CAR) T cell-based therapies have revolutionized the treatment of blood cancers such as leukemia and lymphoma, demonstrating the power of synthetic signaling receptors forimmunotherapy. For these therapies, patientT cellsare harvested, engineered with a CAR, and then reintroduced into the patient. However, CAR T cells have been less successful at treating solid tumors. The recognition and infiltration of solid tumors requires new CAR T cell designs.

While researchers continue to explore the most potent configurations, the combinatorial complexity of potential therapeutic lymphocyte designs, including CAR T cells, is vast. Miskov-Zivanov will create a system that will survey the scientific literature and databases to efficiently retrieve and integrate existing expert knowledge with experimental data and recommend more effective CAR T cells and tumor infiltrating lymphocytes (TILs).

Miskov-Zivanov, a computer engineer whose post-doctoral research has been in computational and systems biology, hopes that the automated framework she is developing can reliably accelerate this process. ""As a computer engineer,"" she said, ""I am driven to automate complex design processes. I explore how tasks traditionally performed manually by biologists can be streamlined and executed automatically using computational approaches.""

In 2023, Miskov-Zivanov received an NSF EAGER Award to create a tool that uses Natural Language Processing (NLP) to extract information from scientific literature and, with the integration of experimental data, help synthetic biologists engineer new CAR T cells.

Building off that two-year project, she will develop a new system that uses both traditional NLP approaches and more recent large language models (LLM) together with neural networks to read, analyze, and interpret research papers and experimental data and conduct comprehensivein silicoexperiments on a wide range of cell designs.

By developing and testing new prompting methods, Miskov-Zivanov hopes that ""instead of a researcher having to go through tens of thousands of papers, many that are irrelevant, the system can extract meaningful data and insights.""

The extracted information will be presented as knowledge graphs (KGs), which she will further refine and analyze using graph neural networks (GNNs) to predict the most effective therapeutic cell designs. This past year at Pitt, Miskov-Zivanov also introduced a new graduate-level course focused on KGs and the methods for their construction and application. She sees great promise in integrating information and structured knowledge within KGs with data-driven predictions enabled by GNNs, and she aims to uncover novel and meaningful connections and relationships that will significantly advance the engineering of new therapies. Equipping the next generation of engineers with these tools is essential for addressing critical, life-saving research challenges.

Miskov-Zivanov hopes to build ""reliable methodology to engineer and test thousands of designs for immunotherapeutic cells such as TILs and CARs with diverse and potent receptor systems."" Her work seeks to advance immunotherapy while developing new algorithmic processes to identify and present trustworthy, predictive scientific data and research.

""Our department of electrical and computer engineering is so proud of Professor Natasa Miskov-Zivanov and her latest achievement, the NSF CAREER Award,"" said Alan George, Department Chair, R&H Mickle Endowed Chair, and professor of electrical and computer engineering. ""She leads the MeLoDy (Mechanisms and Logic of Dynamics) Laboratory, where her research spans a broad range of cutting-edge topics by leveraging her expertise in digital circuits, synthetic biology, artificial intelligence, and dynamic systems. Natasa's new project promises to significantly advance the field of immunotherapy design. She is an innovator in both the laboratory and the classroom, and I am so excited about her future as a rising star in the field."""
Medicine,"NIH-funded project shows that trans-epidermal water loss could indicate if wounds are fully healed.

A research team funded by the National Institutes of Health (NIH) has identified a diagnostic aid that has the potential to accurately predict the recurrence of diabetic foot ulcers that appear to be fully healed. By measuring the skin's barrier function through a process known as trans-epidermal water loss, or TEWL, scientists were able to determine which wounds were more likely to reopen. TEWL measurements are a major factor in burn care, where deep layers of the skin are often damaged. The findings suggest that full restoration of skin barrier function should be incorporated into existing wound treatment standards to ensure complete wound closure and to better identify patients at risk of wound recurrence.

Scientists, working together through the NIDDK Diabetic Foot Consortium, evaluated over 400 study participants who had a diabetic foot ulcer that visually appeared to be closed or healed. They measured TEWL at the site of the foot ulcer and found that 35% of participants with high TEWL (more water loss) reported a wound recurrence by 16 weeks, compared to just 17% for those with low TEWL (less water loss). Participants with higher TEWL were 2.7 times more likely to experience a wound recurrence than participants with low TEWL.

Diabetic foot ulcers are a major complication of diabetes where a break in the skin of the foot is often unnoticed by a patient due to nerve damage, known as neuropathy. They are the leading cause of non-traumatic lower-limb amputations, and untreated or unhealed ulcers significantly increase the risk of death. Wounds that appear to be healed on the surface may not be fully closed below the superficial surface of the skin, hampering the effectiveness of the skin's barrier function to keep in water and keep out pathogens, such as bacteria.

Study results will publish inDiabetes Care, a journal of the American Diabetes Association. The study was funded by NIH/NIDDK grants (U01DK119099, U24DK122927, U01DK119100, U01DK119083, U01DK119094, U01DK119085 and U01DK119102) and carried out by members of NIH's Diabetic Foot Consortium."
Medicine,"Researchers have discovered that, compared to breast cancer that is symptom-detected, patients with breast cancer detected via routine screening mammography are more likely to have improved clinical outcomes, according to a study published today inRadiology: Imaging Cancer, a journal of the Radiological Society of North America (RSNA).

While it is commonly understood that early detection of breast cancer results in better patient outcomes, national cancer registries in the U.S. and Canada don't track the method of cancer detection.

Since improvements in patient outcomes may be incorrectly attributed solely to treatment advances, identifying the association between the method of breast cancer detection and clinical outcomes may have a direct impact on health care policy.

In a retrospective observational analysis, Dr. Seely and colleagues collected data of patients aged 40 years or older who werediagnosed with breast cancerin 2016.

Of the 821 patients included in the study, 50.1% had breast cancer diagnosed as the result of a symptom, rather than as the result of a screening mammogram.

Compared to patients with symptom-detected breast cancer, patients with screening-detected breast cancer had significantly lower odds of an advanced stage of breast cancer, lower odds of undergoing a mastectomy and a lower hazard ratio of death.

Breast cancers detected from symptoms were more frequent in women aged 40 to 49 years and over 75 years of age, 72.9% and 70.4%, respectively. All-cause deaths were also higher among patients who were not undergoing regular screening. Most surprising was how many patients died shortly after their breast cancer was detected, Dr. Seely noted.

""Within only 6.7 years of follow-up, almost 20% of the 821 breast cancer patients had died, half of them from breast cancer,"" Dr. Seely said. ""The patients whose breast cancers were detected because of symptoms had a 63% higher likelihood of dying.""

The researchers concluded that reducing the barriers tobreast cancer screeningin women aged 40 to 74 will improve patient outcomes and reduce the number of patient deaths from cancer. Women over age 75 might also benefit from screening, as these patients were more likely to be diagnosed due to symptoms and required more intensive treatment.

In 2024, the United States Preventive Services Task Force (USPSTF) updated their breast cancer screening guidelines, recommending that women aged 40 to 75 years at average risk undergo breast cancer screening every two years. The Canadian Task Force on Preventive Health Care recommends that women aged 50 to 74 years at average risk undergo breast cancer screening every two to three years.

""The results of this study will likely support the move to reduce the breast cancer screening age to 40 in the U.S. and Canada,"" Dr. Seely said. ""We have lowered the screening age in many provincial and territorial screening programs in Canada and are aiming to establish a single national policy for screening."""
Medicine,"In the realm of colorectal cancer treatments beyond surgery and radiation, one key question gained prominence in recent years: Is the tumor's DNA repair system defective, making it ""microsatellite unstable""? Around 15 to 20 percent of all tumors have this trait, making them likely candidates for successful immunotherapy. So-called immuno-checkpoint inhibitors are often used in these cases to neutralize the tumor's ""protective shield"", which tricks the immune system into perceiving it as harmless tissue. Once this deception is lifted, the body's T-cells can eliminate the tumor.

However, many colorectal cancers remain resistant toimmunotherapyand even to chemotherapy and radiation. The cause lies in the tumor's surrounding environment, explains Prof. Florian Greten, cancer researcher at Georg-Speyer-Haus and Goethe University Frankfurt, and TRR 417 spokesperson: ""Tumors do not grow as foreign bodies within intestinal tissue. Instead, they incorporate 'normal' cells such as fibroblasts, immune cells, and vascular cells. The tumor reprograms these cells and integrates them into a tumor microenvironment, which also closely interacts with gut bacteria and other microorganisms - themicrobiome.""The new Collaborative Research Center TRR 417 ""Cellular Communication in the Stroma of Colorectal Cancer: From Pathophysiology to Clinical Translation"" brings together researchers from medicine, biology, and data sciences at Goethe University Frankfurt, Friedrich-Alexander University Erlangen-Nuremberg, and the University of Freiburg with the aim of continuing the investigation of this tumor microenvironment. Greten explains: ""We are building on the experience we've gained since 2016 through our collaboration in DFG Research Unit 2438 on this topic. In that project, we not only gathered numerous scientific insights but also developed shared standards, models, and technologies."" It is based on this foundation that the researchers will now develop novel therapeutic strategies. ""We want to determine how to deliberately modify the tumor microenvironment and leverage it therapeutically to enhance treatments and make them accessible to immunotherapies - especially for those colorectal cancers that currently respond poorly to existing therapies.""

The DFG will fund TRR 417 for an initial period of four years with around € 17.7 million. The funding may be renewed twice for additional four-year periods."
Medicine,"Accurate monitoring of CD4+T cell counts is vital for evaluating immune health and guiding treatment in people living with Human Immunodeficiency Virus (HIV). Yet conventional tools like flow cytometry, while highly effective, are expensive, complex, and ill-suited for widespread use in remote or resource-limited areas. Many portable alternatives remain constrained by low sensitivity, intricate sample handling, or high operational costs. Optical and fluorescence-based systems, though advanced, further compound these issues with their maintenance and equipment needs. Due to these limitations, there is an urgent need for cost-effective, standalone diagnostic platforms that can be deployed directly at the point of care to ensure timely HIV monitoring.In a collaborative effort, researchers from the University of Bath and Nanyang Technological University have developed an integrated microfluidic electrochemical biosensor for detecting CD4+T cells. Their findings (DOI: 10.1038/s41378-025-00893-8), published on April 9, 2025, inMicrosystems & Nanoengineering, showcase a polydimethylsiloxane (PDMS)-based chip with gold electrodes that uses impedance-based, label-free sensing. Tailored for low-resource settings, the device enables minimizing handling steps and simplifying sample processing, and delivers results within clinically relevant thresholds. This breakthrough marks an important advance toward enabling real-time HIV diagnostics outside of conventional laboratories.At the core of the device is a microfluidic chip embedded with gold electrodes, which enables both the functionalization and detection processes to occur on-chip. Anti-CD4 antibodies are immobilized via self-assembled monolayers, ensuring specific binding of target cells. The sensor's wide dynamic range captures both immunocompromised and healthy CD4+levels, with a detection limit that can identify advanced immunodeficiency. Compared to traditional bench-top systems, the microfluidic design significantly reduces variation and manual labor, improving reproducibility and making the device well-suited for automation. Specificity tests showed negligible interference from monocytes, neutrophils, and common serum proteins. The sensor can also be paired with a Dean Flow Fractionation chip for upstream cell separation, allowing for a fully modular system that integrates cell isolation, capture, and enumeration-all on a single device.

Looking ahead, this microfluidic biosensor could serve as a transformative tool for HIV management in underserved regions, replacing bulky laboratory instruments with portable, battery-powered alternatives. Its flexible design supports the integration of automated sample processing and multiplexed detection of other immune markers or pathogens. The next development stages will involve integrating the DFF chip for whole blood testing, clinical validation, and refining user interfaces for field deployment. Ultimately, this technology could lead to robust point-of-care platforms that support earlydiagnosis, strengthen treatment monitoring, and advance equitable healthcare delivery in global HIV control efforts."
Medicine,"Children exposed to gestational diabetes in utero with a specific variation of a common gene are at a higher risk of becoming overweight or obese during childhood, according to a new study by researchers at the University of Colorado Anschutz Medical Campus.

The study was published today in the journalDiabetes Care.

Scientists have long known that exposure to gestational diabetes is a strong predictor for both childhood obesity and diabetes.

""But it's not infallible,"" said the study's lead author Kylie Harrall, PhD, who did the research while at CU Anschutz but is now an assistant research professor at the University of Florida in Gainesville. ""Some children with in utero exposure to gestational diabetes never develop obesity.""

To understand why, the researchers focused on a receptor gene known as GLP-1R, the same gene activated by the weight loss drugsOzempicand Wegovy. It regulates insulin and appetite.

Previous studies have shown that polymorphisms or common variations of the gene were associated with body mass index (BMI) trajectories across childhood, insulin sensitivity and insulin secretion.

The researchers examined 464 children from the EPOCH study group, a collection of parents and their offspring monitored by researchers to determine the effects of gestational diabetes on the metabolic health of children.

""Our hypothesis was that there were mutations in this receptor that made kids prone to higher BMI,"" said the study's senior author Dana Dabelea, MD, PhD, associate dean of research at the Colorado School of Public Health and director of the Lifecourse Epidemiology of Adiposity & Diabetes Center (LEAD) on the CU Anschutz Medical Campus.

Dabelea and Harrall found that children exposed to gestational diabetes with a polymorphism of the GLP-1R gene gained weight faster and had a higher than average BMI compared to other children.

Harrall agreed and said the study results show that GLP-1R variations help explain why some children exposed to gestational diabetes are more prone to a higher BMI than others.

""This knowledge could help clinicians identify children who are at the highest risk for rapid BMI growth, which would allow for earlier intervention and potentially decrease the risk for childhooddevelopment of type 2 diabetes,"" Harrall said."
