Category,Content
Technical,"Elon Muskmay have stepped awayfrom his duties as the lead of theDepartment of Government Efficiencyand adviser to President Trump, but he’s still active in D.C. circles. This time, he’s on the other side, lobbying lawmakers on legislation related to autonomous vehicles, according to areport by Bloombergthat cited unnamed sources.

Musk and others in his orbit have been calling members of Congress directly, according to Bloomberg. His efforts appear to be directed at a bill introduced May 15 called theAutonomous Vehicle Acceleration Act.

Musk has bet much of Tesla’s future on AI, robotics, and autonomous vehicles. He has frequently tied the company’s value to its investment and eventual commercialization of autonomous vehicles. And next month, Tesla is expected to launch a small andgeofenced robotaxi servicein Austin, Texas. Tesla also wants to eventually roll out autonomous vehicles — branded Cybercabs — that don’t have a steering wheel or pedals. But today there are not clear federal rules or standards to allow such a vehicle to operate at scale."
Technical,"Elon Musk’s X experienced an outage on Friday, according to user reports and crowdsourced data from sites likeDowndetector. From what TechCrunch staff has witnessed firsthand, the X website and app still loaded, but various features were not functioning properly, and entire feeds — like X’s algorithmic For You feed — didn’t load any content.

Others reported thatphotos weren’t loading,X’sbanking service XMoneywasn’t working, the timeline was bare, posts weren’t publishing, and search wasn’t returning results, among other things.

Based on the timing of the user reports, the outage and errors seem to have begun just before 4 p.m. ET on Friday and seem to be resolving as of the time of writing.

During the outage,thousands of users submitted reports to Downdetector,and others more directly complained in X posts and on other social networks, like Bluesky and Threads.

This was the second outage for X in just over a week, as the service also failedon May 22,when X experienced a number of issues over a 24-hour period. During that time, messages wouldn’t load, timelines wouldn’t update, and some posts couldn’t be seen without refreshing the webpage.

The current outage may be short-lived. We noticed that some features seemed to either be intermittently working, or worked on X’s mobile app but not on the desktop, for instance. Then, people began reporting that the service seemed to have come back up.

The X Developer API v2 is stillshowingdegraded status, however.

Just ahead of the outage, X beganrolling out its new DM feature, XChat, into beta afterpausing encrypted DMsas it worked to make improvements. It’s not clear if any of these changes impacted X’s stability, and the company no longer responds to press inquiries since Musk took ownership."
Technical,"Welcome back toTechCrunch Mobility— your central hub for news and insights on the future of transportation. Sign up here for free — just clickTechCrunch Mobility!

It might have been a short week, but there was still plenty of news, including anotherZooxrecall, an update on theStellantis-Amazonpartnership, and a few startup-funding deals.

One item of note: This week, I wrote aboutCarma Technologyand itspatent infringement lawsuitagainstUber. This isn’t a patent troll situation, and the IP attorneys I have spoken with say it will be a challenging case for Uber.

The gist? Carma, which was formed in 2007 by serial entrepreneur and SOSV Ventures founder Sean O’Sullivan, filed a lawsuit earlier this year against Uber, alleging the company infringed on five of its patents that are related to the system of matching riders (or packages) with capacity in vehicles. In other words, ride-sharing.

IP attorney Larry Ashery provided the money quote that explains why this is such a complicated and challenging case.

“What’s important to understand here is, Carma isn’t just asserting five patents. They have had a very sophisticated strategy of patent procurement that they’ve been working on for the past 18 years.”Carma’s five patents are part of a 30-patent family that are all related and connected to the original filing date. That matters because each of the five asserted patents contains multiple patent claims, which define the legal boundaries of the invention. These individual claims — not just the patents as a whole — are what Carma is asserting against Uber.

That means Uber will have to address and defend against each asserted claim, making the litigation more complex and difficult to defeat, Ashery noted.

Let’s get into the rest of the news.

A few little birds have been chirping at us for months now about a new autonomous vehicle technology startup that has been quietly plugging along for a year. The interesting nugget about this startup — which is calledBedrock Robotics— is who is behind it:Boris Sofman, who ledWaymo’s self-driving trucks program and previously co-founded and led the popular consumer robotics companyAnki.

The San Francisco-based startup is still in stealth, but my sources tell me it has raised considerable venture funds. Bedrock Robotics is working on a self-driving kit that retrofits onto construction equipment and other heavy machinery,according to a filingwith the U.S. Patent and Trademark Office.

Got a tip for us? Email Kirsten Korosec atkirsten.korosec@techcrunch.comor my Signal at kkorosec.07, Sean O’Kane atsean.okane@techcrunch.com, or Rebecca Bellan atrebecca.bellan@techcrunch.com.Or check outthese instructionsto learn how to contact us via encrypted messaging apps or SecureDrop.

Firefly Aerospacereceived a$50 million investmentfrom Northrop Grumman as part of its Series D round. This investment will further advance production of the startup’s  co-developed medium launch vehicle, now known as Eclipse.

Pallet, a warehouse logistics software startup based in Fremont, California,raised $27 millionin a Series B funding round led by General Catalyst. Bain Capital Ventures, Activant Capital, and Bessemer Venture Partners also participated.

Volteras, a London-based startup building virtual connective tissue that will allow plugged-in EVs to offer their batteries to support the grid, closed an$11.1 million Series Aled by Union Square Ventures, with participation from Edenred, Exor, Long Journey Ventures, and Wex.

Way Data Technologies, a fleet management startup founded by veterans of Lucid Motors and Wolt,raised €2.6 million($2.95 million) in pre-seed funding led by Pale Blue Dot, with participation from 10x Founders and Greens Ventures.

Rivr’sfour-wheeled, stair-climbing delivery robot— which its CEO and founder, Marko Bjelonic, describes as a dog on roller skates — will ferry packages fromVehovans directly to customers’ front doors as part of a pilot program in Austin, Texas. Both companies see this small pilot as a critical step toward solving a unique slice of the end-to-end autonomous delivery journey.

TuSimple(now CreateAI)sent a trove of sensitive data— effectively the blueprint of an American-made autonomous vehicle system — to a Beijing-owned firm after committing to the U.S. government that it would cease such transfers under a national security agreement. The revelation, first reported by the Wall Street Journal, prompted numerous “not surprised” responses from several readers and sources within the industry.

Zooxissued itssecond voluntary softwarerecall in a month, following a collision between one of its robotaxis and an e-scooter rider in San Francisco on May 8. The incident is notable, largely for what happened after the unoccupied Zoox vehicle operating at low speed was struck by the e-scooter after braking to yield at an intersection.

According to Zoox, the e-scooterist fell to the ground directly next to the vehicle and the “robotaxi began to move and stopped after completing the turn, but did not make further contact with the e-scooterist.”

In other Zoox news, the company announced it was the “official robotaxi partner of Resorts World Las Vegas.” As part of the deal, there will be a dedicated and Zoox-branded robotaxi pickup and drop-off location at Resorts World Las Vegas.

TheTesla Cybertruckis having a rough time. Dozens of unsold Tesla Cybertrucks arepiling up at a Detroit shopping center parking lot. And while Cybertruck owners are now allowed by Teslato trade in their vehiclesfor the first time since they hit the market, they’ll face a steep depreciation hit. CarGurus recently showed depreciation rates of up to 45%.

Meanwhile,Teslasales in Europe and the U.K.have fallen by nearly half, according to data released by the European Automobile Manufacturers Association.

TheVolkswagenemissions cheating scandal of 2015 rippled through the automotive sector and prompted the company (and later followed by others) to shift away from diesel and toward hybrids and electric vehicles. Now, four former Volkswagen executives havereceived prison sentencesfor their role.

Amazonis no longer working withStellantisto createin-car software for the automaker’s vehicles. The partnership, first announced in January 2022, was part of Stellantis’ plan to generate $22.5 billion annually from software. Stellantis told TechCrunch it would be pivoting to an Android-based system."
Technical,"The chief executive of the United States Institute of Peace (USIP) says Elon Musk’s Department of Government Efficiency left the nonprofit’s Washington, D.C., headquarters in disarray, full of water damage, rats, and roaches, according toa new sworn statementfirst reported byCourt Watch.

The statement from the executive, George Moose, comes just a few days after a federal judgeruledthat DOGE’s takeover of the nonprofit was illegal. And this week, Musk has claimed he is stepping away from DOGE, although he and President Trump have said he will continue to advise the administration.

DOGEstarted its takeoverof USIP in mid-March after a standoff that saw the nonprofit call the police on Musk’s government workers. Moose said at the time that DOGE staff had “broken into” the USIP headquarters in Washington, despite the fact that the nonprofit is not part of the executive branch and isn’t subject to the White House’s whims.

“It was very clear that there was a desire on the part of the administration to dismantle a lot of what we call foreign assistance, and we are part of that family,” Moose said at the time, referencing the Trump administration’s and DOGE’s dismantling of the United States Agency for International Development.

Moose initiallysaidthe nonprofit’s headquarters appeared to be in decent shape at a press conference on May 21, where he discussed the judge’s ruling. But one day later, according to the statement, members of Moose’s staff spent a day surveying the building and documenting the problems they found.

Moose wrote in his statement that, ahead of the judge’s ruling, the headquarters had been “essentially abandoned for many weeks” before USIP regained control. He said that DOGE had failed to “maintain and secure the building,” including “evidence of rats and roaches.”

“Vermin were not a problem prior to March 17, 2025, when USIP was actively using and maintaining the building,” Moose wrote.

Staff also reported to Moose that the building’s vehicle barriers were poorly maintained and that they spotted water leaks and “missing ceiling tiles in multiple places in the building (which I have been told suggest likely water damage).”

Now Moose said USIP has “engaged a private security firm to guard the building and premises” and “taken over responsibility for the building’s maintenance.”"
Technical,"If the adoption of AI feels different from any tech revolution you may have experienced before — mobile, social, cloud computing — it actually is.

Venture capitalist Mary Meeker just droppeda 340-page slideshow report— which used the word “unprecedented” on 51 of those pages — to describe the speed at which AI is being developed, adopted, spent on, and used, backed up with chart after chart.

“The pace and scope of change related to the artificial intelligence technology evolution is indeed unprecedented, as supported by the data,” she writes in the report, called “Trends — Artificial Intelligence.”

There’s a certain poetic history to this person writing this kind of report. Meeker is the founder and general partner at VC firm Bond and was onceknown as Queen of the Internetfor her previous annual Internet Trends reports. Before founding Bond, she ran Kleiner Perkins’ growth practice, from 2010-2019, where she backed companies like Facebook, Spotify, Ring, and Block (then Square).

She hasn’t released a trends report since 2019. But she dusted off her skills to document, in laser detail, how AI adoption has outpaced any other tech in human history.

ChatGPTreaching800 million users in 17 months: unprecedented. The number of companies andthe rate at which so many othersare hitting high annual recurring revenue rates: also unprecedented.

The speed at which costs of usage are dropping: unprecedented. While the costs of training a model (also unprecedented) is up to $1 billion, inference costs — for example, those paying to use the tech — has already dropped 99% over two years, when calculating cost per 1 million tokens, she writes, citing researchfrom Stanford.

The pace at whichcompetitors are matching each other’s features, at a fraction of the cost, including open source options, particularly Chinese models: unprecedented. For example, she points out that Nvidia’s 2024 Blackwell GPU uses 105,000x less energy per token than the company’s 2014 Kepler GPU predecessor.

Meanwhile, chips from Google, like its TPU (tensor processing unit), andAmazon’s Trainium, are being developed at scale for their clouds — that’s moving quickly, too. “These aren’t side projects — they’re foundational bets,” she writes.

The one area where AI hasn’t outpaced every other tech revolution is in financial returns. WhileVCs are pouring moneyon the AI fire as fast as they can, AI companies and cloud service providers are also burning through cash. AI requires massive investments in infrastructure.

That’s good for consumers and enterprises, the beneficiaries of fast improvements, while competition lowers costs, Meeker points out. But the jury is still out over which of the current crop of companies will become long-term, profitable, next-generation tech giants. “Only time will tell which side of the money-making equation the current AI aspirants will land,” she writes.

As for the rest of us: Just hold on to your hats."
Technical,"The Department of Energy announced today that it would be clawing back $3.7 billion worth of awards made under the Biden administration for clean energy and manufacturing. Large corporations and growing startups were caught up in the decision.

Energy secretary Chris Wright said the moves were “due diligence” on the part of the Trump administration. His statement did not cite specific reasons why the projects were canceled, but pointed to amemorandumhe issued on May 15, which suggests that the department may attempt to use its audit powers to rescind the awards.

In total, 24 projects are affected by the move, including ones being developed by oil and gas giant Exxon Mobil, food manufacturer Kraft Heinz, industrial heat startup Skyven, cement and alumina startup Brimstone, and cement startup Sublime Systems.

Here’s a sampling of some of the awards in jeopardy:

Sublime told TechCrunch that it was caught off guard.

“Sublime was surprised and disappointed to receive the news about the termination of our Industrial Demonstrations Program award, given the clear progress we’ve made in scaling our American-invented technology, partnering with some of the Western World’s largest cement producers, and generating a bankable customer base,” spokesperson Rob Kreis said via email. The startup is evaluating its options to continue scaling up its operations.

Brimstone is hopeful that things can be resolved with the DOE.

“Given our project’s strong alignment with President Trump’s priority to increase U.S. production of critical minerals, we believe this was a misunderstanding. Brimstone’s Rock Refinery represents the only economically viable way to produce the critical mineral alumina in the U.S. from U.S.-mined rocks,” Brimstone spokesperson Liza Darwin told TechCrunch via email.

“As the first U.S.-based alumina plant in a generation, our project — which would also make portland cement — would clear a ‘mine-to-metal’ path for U.S. aluminum production, fortifying the U.S. critical mineral supply chain and creating thousands of jobs,” she added."
Technical,"WordPress.com parent company Automattic is changing direction… again.

Ina blog posttitled “Returning to Core” published Thursday evening, Automattic announced it will unpause its contributions to the WordPress project. This is despite having said only last monththat the 6.8 WordPress releasewould be the final major release for all of 2025.

“After pausing our contributions to regroup, rethink, and plan strategically, we’re ready to press play again and return fully to the WordPress project,” the new blog post states. “Expect to find our contributions across all of the greatest hits — WordPress Core, Gutenberg, Playground, Openverse, and WordPress.org. This return is a moment of excitement for us as it’s about continuing the mission we’ve always believed in: democratizing publishing for everyone, everywhere,” it reads.

Automattic says it’s learned a lot from the pause in terms of the many ways WordPress is used, and that it’s now committed to helping it “grow and thrive.”

The post also notes that WordPress today powers 43% of the web.

It’s unclear what has changed.

However, according to sources who spoke to TechCrunch, Automattic CEO Matt Mullenweg explained in an internal post published last night that he wants to get a 6.9 release out this year with an admin refresh and something from the “new AI team.” (The latter references this week’s announcement thatWordPress formed a new team to steward the development of AI projects.)

“I don’t think that will happen without our contributions,” the post stated, according to a source familiar with the internal discussions.

Insiders are speculating there’s more to it than that, and various theories are being floated. Some wonder if Mullenweg was pressured into this move or if he realized that pulling back wasn’t good for his business or its reputation? Others are debating if this change of heart has to do with Automattic’s ongoing litigation with WordPress’ hosting company, WP Engine, which Automattic has called a “threat” to the WordPress communityand a “cancer to WordPress.”

No one knows what to believe, and none of these backchannel theories line up with the officially stated reason.

Automattic was asked for additional comment.

Since 2024, Automattic has been engaged in a legal dispute that has to do with how little, in Mullenweg’s opinion, WP Engine contributes to the WordPress project, despite its size and revenue.

He sees the hosting company as profiting off the open source work WordPress is doing without giving back. Mullenweg also alleges that WP Engine benefits from the confusion between WordPress and commercial services like WP Engine. This led him to ban the company from accessing WordPress.org and sue in court forunauthorized trademark usage.

Simply put, Mullenweg thinks WP Engineshould either paya direct licensing fee or up its contributions to the open source WordPress project, or shouldn’t be allowed to use its trademark.

WP Enginerespondedthat it doesn’t think it needs a license and that Automattic misunderstands trademark law,suing Automattic in return.

Last month,Automattic laid off 16% of staff,saying the restructuring was necessary to be more agile and improve its productivity and profitability.

Sarah Perez can be reached at @sarahperez.01 on Signal and sarahp@techcrunch.com ."
Technical,"Welcome to Startups Weekly — your weekly recap of everything you can’t miss from the world of startups. Want it in your inbox every Friday?Sign up here.

This week brought more than justNvidia’s earnings reports; startups and VCs also had some news — quieter perhaps, but still worth paying attention to, especially where AI is involved.

AI once again drove a large share of overall startup activity, including one acquisition, but this week also brought us a reminder that full M&A execution takes time — and that VC funding is not the only route.

Good optics:AMDacquired Enosemi, a startup designing custom materials to support silicon photonics product development, under undisclosed terms. The goal of the acquisition is to “accelerate [AMD’s] co-packaged optics innovation for AI systems.”

Onboarded:AI startup Anthropicadded Netflix co-founder Reed Hastingsto its board of directors. Hastings was appointed by Anthropic’s independent Long-Term Benefit Trust and already has experience sitting on the boards of Netflix, Bloomberg, Meta, and Microsoft.

It takes time:Family safety app Life360finally incorporatesthe AirTag-like lost item tracking functionalities of Tile, three and a half years after Life360 acquired Tilefor $205 million.

One month and 25 days:High-profile entrepreneur and angel investor Sahil Lavingia revealed details of his stint on Elon Musk’s DOGE workforce, saying he wasbooted after only 55 days. But it’s not just him: Musk’s stint is alsocoming to an end.

Bootstrapped:Ten-year-old cybersecurity company Thinkst Canary reached$20 million in annual recurring revenue without VC investment— an interesting story that seemed worth mentioning before diving into funding news.

Funding news this week comes from a mix of announcements and rumors — unconfirmed but well-sourced. Let’s start with these before moving on to the more concrete updates.

Musk again:Neuralink, Elon Musk’s brain implant startup, reportedly raised$600 million at a $9 billion pre-money valuation.

Long arm: Samsung is said to be looking to invest ina $100 million round for medical device startup Exothrough its venture investment arm.

New horizon: Filings revealed that cybersecurity startup Horizon3.ai isseeking to raise $100 million, out of which it has already secured at least $73 million.

New bricks: Buildots, a Chicago-based startup leveraging AI and computer vision to improve construction progress tracking, raiseda $45 million Series D, bringing its total raised to $166 million.

Adding up:Rillet, a startup using machine learning and generative AI to automate accounting reports,raised a $25 million Series Aled by Sequoia Capital, only 10 months after a $13.5 million seed and pre-seed round.

Convenience:Snabbit, a 15-month-old Indian startup operating in the increasingly hot home services space,secured $19 million in a Series B roundled by Lightspeed at a post-money valuation of $80 million.

World models:SpAItial, the new company of Synthesia co-founder Matthias Niessner,raised a $13 million seed roundled by Earlybird to develop a foundation model capable of generating interactive 3D online environments. It would share similarities with the AI modelreleased by competitor Odysseythis week.

Advanced grid: Gridcare, an AI-powered energy optimization startup, emerged out of stealth withan oversubscribed $13.5 million seed roundand said it’s ready to play matchmaker between data centers and utilities.

Diversifying: State-owned Saudi AI company Humain is making progressto launch Humain Ventures, a $10 billion venture fund that will invest in startups in the U.S., Europe, and Asia.

Kiwi startups: Auckland-based venture firm and incubator Outset Venturesclosed a second fundof approximately $25 million to invest in deep tech startups emerging out of New Zealand.

Nuclear fusion startups have beenattracting investors, but their endeavors are still experimental. Fission, on the other hand, already has the potential to power data centers, which explains why Big Tech companies have beeninvesting in nuclear fission startups."
