Category,Content
Medicine,"As breast cancer deaths linked to red meat surge in younger women, especially in developing nations, research explains why changing what’s on your plate could save lives.

Study:Global, regional, and national analyses of the burden among adult women of breast cancer attributable to diet high in red meat from 1990 to 2021: longitudinal observational study. Image Credit: Explode / Shutterstock

In a recent study in the journalFrontiers in Public Health, researchers investigated temporal, geographic, and socio-demographic trends and risk associations in female breast cancer worldwide. Specifically, the study leveraged more than 30 years of data (1990–2021) from the Global Burden of Disease (GBD) 2021 study to quantify the impacts of high unprocessed red meat consumption on regional, national, and global breast cancer–associated mortality and disability-adjusted life years (DALYs).

Study findings indicated significant increases in unprocessed red meat-associated model-estimated numbers of mortality (from 44,492 in 1990 to 79,956 in 2021, a 79.7% rise) and model-estimated DALYs (from 1,379,721 to 2,407,092, a 74.5% rise) between 1990 and 2021, with low- and middle socio-demographic index (SDI) regions experiencing particularly pronounced impacts, although the patterns varied. For instance, age-standardized rates (ASR) of mortality and DALYs declined in high SDI regions, while low-middle SDI regions saw significant increases in these age-standardized rates. Low SDI regions, despite lower absolute numbers of deaths and DALYs, experienced sharp relative increases in these absolute figures. These findings detail the ongoing increases in global breast cancer burden among adult women (ages 25–45 yrs), highlighting the demerits of healthcare disparities and Western dietary patterns and emphasizing the need for targeted healthcare and nutritional interventions to mitigate breast cancer in the future.

Global meat consumption has been rising at unprecedented rates, almost doubling since 1961, with developing nations (e.g., China) demonstrating the highest increases. Unfortunately, a growing body of literature suggests that high red meat consumption (RMC) has a detrimental impact on human health, particularly concerning cancer incidence and progression.

Consequently, the International Agency for Research on Cancer has classified unprocessed red meat as “probably carcinogenic to humans” (Group 2A carcinogen, 2015). Unfortunately, studies explicitly investigating the associations between RMC and subsequent cancer risk have produced inconsistent and confounding results, triggering a global debate on the safety of RMC. Notably, a comprehensive analysis of the burden of breast cancer in adult women attributable to high unprocessed red meat consumption, using the latest GBD 2021 data and examining temporal trends across various SDI levels, had not been undertaken until this study.

Breast cancer is a leading global cause of female morbidity and mortality, accounting for 670,000 deaths in 2022 alone. While public health interventions have gradually curbed mortality rates in developed nations, predictive models suggest that the overall global burden of breast cancer will exacerbate in the coming years, emphasizing the need for improved medical understanding of factors (particularly modifiable) contributing to disease risk.

Impact of red meat consumption on DALYs and deaths across regions and SDI levels.(A)Proportion of breast cancer DALYs (Disability-Adjusted Life Years) is attributed to diets high in red meat across different global regions.(B)Proportion of breast cancer deaths attributed to diets high in red meat across different global regions.(C)Proportion of breast cancer DALYs attributed to diets high in red meat across various Sociodemographic Index (SDI) levels.(D)Proportion of breast cancer deaths attributed to diets high in red meat across various Sociodemographic Index (SDI) levels.

The present study aims to estimate the impacts of high unprocessed RMC on breast cancer-associated adult female deaths, age-standardized mortality rates (ASMR), disability-adjusted life years (DALYs), and age-standardized DALY rates (ASDR) across regional, national, and global scales. It aims to inform women, clinicians, and public health agencies about behavioral and dietary modifications (actionable strategies) that can help mitigate breast cancer risk, ultimately leading to a safer and healthier tomorrow. The study methodology and analyses adhere to the Guidelines for Accurate and Transparent Health Estimates Reporting (GATHER) guidelines.

Study data were obtained from the Global Burden of Disease (GBD) 2021 study, a comprehensive database that combines records from 204 countries between 1990 and 2021, tracking disease burden over time. Specifically, researchers extracted data on gender (female), age (25–45 years), region, socio-demographic index (SDI), exposure (high unprocessed RMC defined as >23 grams/day), and outcomes (deaths and DALYs; the study did not focus on breast cancer incidence or prevalence as primary reported outcomes). They used these to compute ASMR, DALYs, and ASDR. In the GBD framework, DALYs are calculated as the sum of years of life lost (YLL) and years lived with disability (YLD).

Statistical models (linear regressions) were used to evaluate temporal trends in unprocessed RMC-associated breast cancer metrics via an ‘estimated annual percentage change (EAPC)’ metric. To ensure the robustness, generalizability, and reproducibility of the results, all models were adjusted for potential confounders (e.g., stratified by age), SDI (low, low-middle, middle, high-middle, and high), and regions (using hierarchical cluster analysis), and were expressed in per 100,000 people metrics.

Study findings revealed a stark surge in global unprocessed RMC-associated female breast cancer burden between 1990 and 2021. Breast cancer-related model-estimated numbers of mortality increased from 44,492 to 79,956 (an approximate 79.7% rise), while model-estimated DALYs increased from 1,379,721 to 2,407,092 (an approximate 74.5% rise).

EAPC analyses, however, highlighted that trends in age-standardized rates (ASR) were significantly varied across SDIs and regions. It is important to distinguish between changes in absolute numbers and changes in these age-standardized rates. High SDI regions demonstrated reductions in ASMR (an EAPC of -1.47%) and ASDRs (an EAPC of -1.48%). In contrast, low-middle SDI regions experienced substantial increases in these age-standardized rates (EAPC for ASMR: 1.39%; ASDR: 1.42%). High-middle SDI regions also showed significant increases in the absolute number of deaths and DALYs, though their age-standardized rates (EAPC) declined. Low SDI regions, despite lower absolute numbers of deaths and DALYs, experienced sharp relative increases in these absolute figures. The study also reported a nonlinear, ""S""-shaped association between overall ASMR/ASDR and SDI at regional and national levels, with the burden typically peaking in moderate SDI regions.

At the country level, China demonstrated a sharp rise in the absolute number of breast cancer deaths attributed to high unprocessed red meat consumption, from the GBD 2021 study's reported model-estimated 44.98 deaths for China in 1990 to model-estimated 125.86 deaths for China in 2021 (these are absolute model-based estimates specific to China, not rates per 100,000 or regional totals for East Asia), reflecting its substantially increased RMC during the last 30 years. In absolute numbers of deaths in 2021, India reported over 190 deaths. From the perspective of age-standardized DALY rates (ASDR), smaller island nations such as American Samoa (167.25 per 100,000), Nauru (161.33 per 100,000), and Palau (161.32 per 100,000) exhibited especially high breast cancer burdens. In contrast, Western Europe presented declines in ASDR between 1990 and 2021.

Age-stratified risk assessment identified women in the 40–44 years cohort as the most vulnerable, demonstrating increased mortality and DALYs across all investigated regions and SDIs.

The present study provides evidence quantifying the significant and growing population-level burden of breast cancer attributable to high unprocessed red meat consumption, reinforcing its observed association with breast cancer development on a population scale rather than implying direct individual causality. It highlights high-risk populations (SDI and age), regional healthcare disparities, and temporal trends in breast cancer morbidity and mortality, underscoring the urgent need for region-specific tailored dietary interventions to mitigate the projected rise in the disease’s burden. The paper also notes limitations, including data gaps in certain regions and the consideration of only a few behavioral and metabolic risks."
Medicine,"RTX is a non-addictive pain therapy derived from a cactus-like plant.

National Institute of Health (NIH) scientists report that a first-in-human clinical trial of a new therapy based on the plant-derived molecule resiniferatoxin (RTX) shows that it is a safe and effective agent for pain control in patients with intractable cancer pain. Researchers tested a single injection of small quantities of RTX into the lumbar cerebral spinal fluid (by lumbar puncture) of advanced-stage cancer patients and found that it reduced their reported worst pain intensity by 38% and their use of pain-relieving opioids by 57%.

The trial enrolled research participants with terminal end-stage cancer who were among the 15% of cancer patients unable to find pain relief from standard of care pain interventions, including vast quantity of opiates without relief.

A single injection of RTX provided patients durable relief. Patients' need for pain-relieving opioids declined sharply, and their quality of life improved. They no longer needed to spend significant periods being sedated with opioids and after treatment were able to reengage with their family, friends and communities.

The NIH scientists believe RTX has potential to treat many other pain conditions, including other types of cancer pain,chronic painfrom nerve injuries called neuromas, post-surgical pain, a facial pain condition called trigeminal neuralgia, and chronic oral inflammatory problems following head and neck radiation therapy.

""Targeting specific nerves brings many pain disorders into range of RTX and allows physicians to tailor the treatment to the patient's pain problem. This interventional approach is a simple path to personalized pain medicine,"" said senior study author Michael Iadarola, PhD, a senior research scientist in the NIH Clinical Center Department of Perioperative Medicine.

RTX is not addictive and doesn't cause a high. Instead, it prevents pain signals from reaching the brain by inactivating a specific sub-group of nerve fibers which transmit heat and pain signals from damaged tissue. RTX is an activator of the transient receptor potential vanilloid 1, or  TRPV1 ion channel and a super-potent equivalent of capsaicin, the active molecule in hot peppers. The ability of RTX to open the channel pore in TRPV1 allows an overload of calcium to flood into the nerve fiber and block its ability to transmit pain signals.

""Basically, RTX cuts the pain-specific wires connecting the body to the spinal cord, but leaves many other sensations are intact,"" Iadarola said. ""These TRPV1 neurons are really the most important population of neurons that you want to target for effective pain relief.""

Iadarola's contributions have led decades of basic science research into the neurobiology of pain and pain control. That body of research has informed them that to effectively block pain, you must block it from getting into the spinal cord and from there having it leave the spinal cord to transit to the brain, where we perceive pain.

Unlike other current approaches that use heat, cold, chemicals, or surgery to non-selectively interrupt nerves to stop pain, RTX targets the specific sensory pathways of tissue damage pain and heat. Other sensory pathways, such as touch, pin prick, pressure, muscle position sense (known as proprioception), and motor function, remain intact. It is not a generalized numbing as occurs with local anesthetics.

""What makes this unique from all the other things that are out there is this is so highly selective,"" Mannes said. ""The only thing it seems to take out is heat sensation and pain.""

RTX is derived from theEuphorbia resiniferaplant, a cactus-like plant native to North Africa. Euphorbia extract has been known for 2,000 years to contain an ""irritant"" substance, which NIH scientists identified how to use for patients through basic research on living cells observed through a microscope. Adding RTX to TRPV1-containing cells caused a visible calcium overload, which Iadarola and Mannes eventually translated into an early-stage human clinical trial.

The next steps include additional, larger clinical trials to move RTX toward eventual approval by the U.S. Food and Drug Administration and clinical availability.

This research was supported by the Intramural Research Program of the NIH Clinical Center and NIH's National Institute of Neurological Disorders and Stroke."
Medicine,"Immediate recovery efforts receive the most attention after severe natural disasters, yet new data from researchers at Drexel University and the University of Maryland suggests these climate events often also leave a critical long-term - and often unaddressed - problem in declines in access to health care.

The team found a statistically significant link between severe natural disasters, such as heatwaves, droughts, floods and wildfires, and loss of health care infrastructure - including hospitals and outpatient care facilities.

Data was drawn from 3,108 United States counties nationwide from 2000-2014. It included whether a county never had, lost, gained, or always had a health care facility, and a record of 6,263 climate disasters those counties experienced during that period. After adjusting for other factors that could impact closures, such as total population and poverty, the team found an even stronger association between severe climate events and closures of outpatient care practices. The findings were recently published in theInternational Journal of Environmental Research and Public Health.County-level disaster data came from the Spatial Hazards and Events Losses database. Using data on losses, the researchers classified each disaster's impact as ""minor"" (causing a death or less than $10 in property damage per capita), ""moderate"" (causing two deaths or $10-50 in damage per capita), or ""major"" (causing three or more deaths or more than $50 in property damage per capita). Health care infrastructure data came from the National Establishment Time Series database.

Unlike previous studies that typically focused on a single disaster in a single location, such as Hurricane Katrina and Hurricane Sandy, the currently study captured all climate-related disaster events nationwide during the time period.

By 2050, the effects of climate change across the globe are predicted to cause 14.5 million deaths, as well as $12.5 trillion in economic costs (including $1.1 trillion faced by health care systems), according to a 2024 World Economic Forum report.

""Our study offers another key data point to support investment in public health infrastructure, as well as disaster planning and recovery efforts,"" said lead author Kevin Chang, MD, who contributed to the research as a medical student in Drexel's College of Medicine. ""Without these investments, more patients will experience an interruption in care and worse health post-disaster.""

The team found no link between closures of pharmacies and climate disasters, and suspect that this is due to the wide prevalence of ""pharmacy deserts,"" communities that lack access to a pharmacy - created by the expanded role of pharmacy benefit managers and use of online pharmacies across the United States. The study did not examine other types of medical facilities, such as community health centers, urgent care, and long-term care practices.

The team's study also showed that counties that lost health care facilities were more likely to experience high poverty and greater racial segregation. Similarly, counties that maintained or gained health care facilities following a natural disaster had lower levels of poverty.

""More affluent communities often have better connections, such as political influence, that help them maintain these important health institutions following a period of crisis,"" said Michael. ""These collaborations after a natural disaster are especially critical in low-income communities that often otherwise lack the resources to rebuild shuttered health institutions.""

The authors suggest that these findings may be conservative, considering the increasing number of climate-induced natural disasters and costs associated with these events. Future studies, the authors suggest, should seek out what influences this link between climate disasters and loss of health care infrastructure, including policy, funding and measures of community resilience."
Medicine,"A dysfunction in muscle blood vessels could be to blame for the weak muscles and weight loss that most cancer patients experience, according to a new study from University of Illinois Chicago researchers.

The discovery may help cancer survivors regain their muscle strength, which could contribute to better outcomes for these patients, said Dr. Jalees Rehman, senior author of the new paper and the Benjamin J. Goldberg Professor and head of the department of biochemistry and molecular genetics at the College of Medicine.

Up to 80% of patients with cancer experience muscle wasting, known as cachexia, a debilitating complication marked by extreme fatigue, weight loss and lack of appetite.

""It is one of the major determinants of poor outcomes in cancer survivors, if they're unable to engage in their activities of daily living because they've lost a lot of their muscle strength,"" said Rehman, who is also co-leader of the Translational Oncology Research Program at the University of Illinois Cancer Center.

As cancer progresses, a tumor molecule circulating in the bloodstream can flip a ""molecular switch"" in muscle blood vessel cells and cause them to malfunction, according to the study published inNature Cancer.However, blood vessel health can be restored by turning ""on"" this molecular switch, thereby reversing the muscle wasting.

There's no FDA-approved treatment for cachexia, and common treatment plans focusing on nutrition and exercise don't seem to suffice, Rehman said. Past studies of cachexia focused on how an immune response leading toinflammationin the muscle might cause the condition.

Blood vessels are the highways in the body, bringing nutrients and oxygen to organs, including the muscles. But they also contribute to essential organ function and health. ""They are more than just passive conduits; they help instruct our organs and tissues,"" Rehman said.

The researchers used an animal model of pancreatic cancer to compare the blood vessels in sick, cachexic muscles and healthy muscles. With high-resolution 3D microscopy, they showed that cachexic muscles have fewer blood vessels than healthy muscles.

They also found that these muscles had less mass and thinner fibers and couldn't perform as well on tests of strength. The same was true when they looked at models of other cancers, including colon cancer, lung cancer and skinmelanoma, and when they tested muscle samples from cancer patients.

Next, the researchers analyzed the genes in cells lining the muscles' blood vessels, known as endothelial cells. The endothelial cells of cachexic muscles were more aged, leaky and prone to dying than those in healthy muscles, said Kim.

""The more vascular dysfunction there is, the more the muscle seems to suffer,"" Rehman said.

They found that a molecule called activin A was more prevalent in the endothelial cells with cancer cachexia than in healthy ones. This increased activin A suppressed the expression of an important protein called PGC1α,"" Rehman said. The researchers found that switching PGC1α back ""on"" restored blood vessel health and subsequently improved muscle strength.

Rehman and his colleagues are working on therapies that can target PGC1α and activin A as treatments for cachexia in cancer.

Other UIC co-authors on the study include Mark A. Sanborn, Shaluah Vijeth, Priyanka Gajwani, Xinge Wang, Dahee Jung, Tibor Valyi-Nagy, Sreeparna Chakraborty, Georgina

Mancinelli, Peter T. Toth, Evan H. Phillips, Paul Grippo, Dr. Ameen Salahudeen, Jooman Park, Su Yeon Yeon, Dr. Vijayalakshmi Ananthanarayanan, Yuwei Jiang, Steve Seung-Young Lee and Klara Valyi-Nagy."
Medicine,"Researchers gave participants face tattoos that can track when their brain is working too hard. Published May 29 in the Cell Press journalDevice, the study introduces a non-permanent wireless forehead e-tattoo that decodes brainwaves to measure mental strain without bulky headgear. This technology may help track the mental workload of workers like air traffic controllers and truck drivers, whose lapses in focus can have serious consequences.

Humans perform best in a cognitive Goldilocks zone, neither overwhelmed nor bored. Finding that balance is key to optimal performance. Current mental workload assessment relies on the NASA Task Load Index, a lengthy and subjective survey participants complete after performing tasks.

The e-tattoo offers an objective alternative by analyzing electrical activity from the brain and eye movement, in processes known as electroencephalography (EEG) and electrooculography (EOG). Unlike EEG caps that are bulky with dangling wires and lathered with squishy gel, the wireless e-tattoo consists of a lightweight battery pack and paper-thin, sticker-like sensors. These sensors feature wavy loops and coils, a design that allows them to stretch and conform seamlessly to the skin for comfort and clear signals.

""What's surprising is those caps, while having more sensors for different regions of the brain, never get a perfect signal because everyone's head shape is different,"" says Lu. ""We measure participants' facial features to manufacture personalized e-tattoos to ensure that the sensors are always in the right location and receiving signals.""

The researchers tested the e-tattoo on six participants who completed a memory challenge that increased in difficulty. As mental load rose, participants showed higher activity in theta and delta brainwaves, signaling increased cognitive demand, while alpha and beta activity decreased, indicating mental fatigue. The results suggest that the device can detect when the brain is struggling.

The device didn't stop at detection. It could also predict mental strain. The researchers trained a computer model to estimate mental workload based on signals from the e-tattoo, successfully distinguishing between different levels of mental workload. The results show that the device can potentially predict mental fatigue.

Cost is another advantage. Traditional EEG equipment can exceed $15,000, while the e-tattoo's chips and battery pack costs $200, and disposable sensors are about $20 each. ""Being low cost makes the device accessible,"" says author Luis Sentis from UT Austin. ""One of my wishes is to turn the e-tattoo into a product we can wear at home.""

While the e-tattoo only works on hairless skin, the researchers are working to combine it with ink-based sensors that work on hair. This will allow for full head coverage and more comprehensive brain monitoring. As robots and new technology increasingly enter workplaces and homes, the team hopes this technology will enhance understanding of human-machine interaction.

""We've long monitored workers' physical health, tracking injuries and muscle strain,"" says Sentis. ""Now we have the ability to monitor mental strain, which hasn't been tracked. This could fundamentally change how organizations ensure the overall well-being of their workforce."""
