Category,Content
Technical,"We were blown away by the incredible interest in speaking atTechCrunch Disrupt 2025, happening October 27-29 at Moscone West in San Francisco.

After a thorough review, we’ve narrowed it down to 20 standout finalists — 10 for breakout sessions and 10 for roundtables.

Now it’s your turn to decide.Audience Choice voting is open through May 30 at 11:59 p.m. PT. You can cast one vote per session — and vote for as many sessions as you like!

The top five breakout and top five roundtable sessions will earn a spot on theDisrupt agenda.

How to Get Acquired in Tech (Without Selling Out): M&A Tips for Founders and BuildersAklil Ibssa, Head of Corporate Development and M&A, Coinbase

Agentic AI for Startups: Automate, Adapt, and Accelerate GrowthAnmol Rastogi, Head of Product, Amazon Business — AI & ML, Amazon

Automation with Agents: From Work Enablement to Work CompletionChet Kapoor, Chairman and CEO, DataStax

AI at the Brink: Strategic Playbook for National SecurityDan Hendrycks, Executive and Research Director, Center for AI Safety (CAIS)

Leading a Series A Round in 2025 and Sustaining MomentumGabriel Kra, Managing Director, Prelude Ventures

The Agentic Apocalypse: Securing the Enterprise in the Age of 1 Billion AI AgentsJack Hidary, CEO, SandboxAQ and Jim Breyer, Founder and CEO, Breyer Capital

Embracing AI for a Better Digital FutureMatt Madrigal, Chief Technology Officer, Pinterest

Mining for Millions with GenAI’s 4 Ds: Striking Trust, Delight, and DividendsMichael Stewart, Managing Partner, M12

From Data to Agents: Building the AI-Native EnterpriseSridhar Ramaswamy, Chief Executive Officer, Snowflake

From Vibes to Velocity: How AI Tools Can Help You Achieve Your Development GoalsTim Rogers, Staff Product Manager, GitHub Copilot, GitHub

Future of Space Economy in the Low Earth OrbitAbhijeet Kumar, Invited Lecturer — New Space Economy, UC Berkeley | Tech and Strategy Lead, Archer

From Startup to Scale-Up: A GTM BlueprintAnjai Lal, Head of Strategy and Enablement, Google Cloud

From Code to Capital: How VCs Spot the Next AI PowerhousesAvi Bharadwaj, Investment Director, Intel Capital

The Winning Formula: Turning Your Business into a Trusted, Scalable Community to Drive GrowthJustine Palefsky and Tasneem Amina, Co-founders, Kindred; and Vlad Loktev, Partner, Index Ventures

How to Train Your Model: Taming AI Agents Without Breaking ThemKyla Guru, Head of Model Cyber Policy, Anthropic and Alex Moix, Investigations Lead, Safeguards, Anthropic

Going a Layer Deeper: Why the Future of AI Investments Lies with Infrastructure and ApplicationsPaul Drews, Managing Partner, Salesforce Ventures

Scaling Search and AI for Millions: Lessons from Reddit SearchRachel Miller, Product Manager, Reddit

AI Evaluation 101: Addressing Challenges to Real-World AI ApplicationsRohit Patel, Director, Generative AI, Meta

From Workarounds to Breakthroughs: How UpLink Lets Users Connect Any App — No Integration NeededScott Weinert, CTO and Co-founder, Atomic

Whose Company Is It, Anyway?: What You Lose When You Accept Outside CapitalSridhar Vembu, Chief Scientist, Zoho"
Technical,"A familiar problem is facing new entrants in the AI industry:How do you break through when the incumbents are so entrenched?That’s just one of the questions we’re tackling atTechCrunch Sessions: AI, happeningJune 5atUC Berkeley’s Zellerbach Hall. We’re not just offering answers — we’re bringing insights from top experts likeLinearCOO Cristina Cordova.

Your curiosity will be piqued by our extensive speaker lineup, your network will expand through curated connections, and you’ll walk away plugged into the pulse of what’s next in AI.

For a limited time, register with a $300 discount — plus, get 50% off an additional ticket for a co-founder, colleague, or friend. Ready to join us?Head here to registerbefore the discount disappears when the event doors open!

If you want to learn more about our programming, let’s dive in.Cordovawill join the main stage alongside AI heavyweightsOliver Cameron, CEO of Odyssey, andAnn Bordetsky, partner at NEA, for a session focused on a key challenge in this growing industry: the competitive landscape is shaped not only by startups but also by powerful incumbents. That’s the reality — and that’s why we’re also bringing perspectives from members of OpenAI, Anthropic, and Google toTC Sessions: AI.

For anyone looking to compete with industry giants, this session is a must-attend. Cordova brings extensive experience as a builder, and at Linear, she’s using that expertise to advance their mission of delivering a more powerful, effective platform for project and software development.

Though she’s currently COO at Linear, Cordova wears many hats. She’s an active angel investor and advisor to early-stage startups. AsStripe’s 28th employee, she spent seven years helping the company scale rapidly — even building the Partnerships team from the ground up. If you’ve noticed Notion’s rapid rise, that’s partly thanks to Cordova, who led their Platform & Partnerships team and drove growth, especially within their self-serve business.

TC Sessions: AIzeroes in on practical solutions and real-world use cases that can drive immediate business impact and spark the next wave of ventures. Whether you’re an industry leader or an emerging disruptor, this is an event you can’t afford to miss.

Right now, you can grab a $300 discount — plus get 50% off a second ticket. But act fast: Once the doors open on June 5, these deals disappear.Register now before it’s too late!"
Technical,"LexisNexis Risk Solutions, a data broker that collects and uses consumers’ personal data to help its paying corporate customers detect possible risk and fraud, has disclosed a data breach affecting more than 364,000 people.

The company said ina filing with Maine’s attorney generalthat the breach, dating back to December 25, 2024, allowed a hacker to obtain consumers’ sensitive personal data from a third-party platform used by the company for software development.

Jennifer Richman, a spokesperson for LexisNexis, told TechCrunch that an unknown hacker accessed the company’s GitHub account.

The stolen data varies, but includes names, dates of birth, phone numbers, postal and email addresses, Social Security numbers, and driver license numbers.

It’s not immediately clear what circumstances led to the breach. Richman said LexisNexis received a report on April 1, 2025 “from an unknown third party claiming to have accessed certain information.” The company would not say if it had received a ransom demand from the hacker.

Data brokers like LexisNexis are part of a billion-dollar industry of companies that profit from collecting and selling access to large amounts of Americans’ personal and financial data. LexisNexis uses swathes of consumer information to help companies detect potentially fraudulent transactions, as well as to perform risk assessment and due diligence on would-be customers.

Last year,The New York Timesreported that car manufacturers were among several companies that shared data on vehicle driving habits with LexisNexis without car owners’ explicit permission. The data was then sold on to insurance companies, which used the mileage and driving data to determine the drivers’ insurance premiums.

Law enforcement agencies also use LexisNexis for obtaining personal information on suspects, such asnames, home addresses, and call records.

Earlier this month, the Trump administration scrapped a plan that would haverestricted data brokers from selling Americans’ personal and financial information, including Social Security numbers. White House official Russell Vought wrote in a Federal Register notice that the Biden-era rule, which would have required data brokers to follow the same federal privacy rules as credit bureaus and renter-screening companies, was “not necessary or appropriate,” despite long-standing calls by privacy advocates to close the loophole.

Updated with comment from LexisNexis."
Technical,"TechCrunch Sessions: AItakes over UC Berkeley’s Zellerbach Hall in just one week — join usJune 5for a full day of networking, learning sessions,satellite events, and more. And we’re adding another excellent speaker to our already packed lineup:Tkxelfounder and CEO Umair Javed, who will be exploring the potency and potential for agentic AI to help small businesses.

Getting a seat at the forefront of the AI industry has never been easier. For a limited time, save up to $300 on your pass — and get 50% off a second guest ticket.Register nowbefore these special deals disappear when the doors open on June 5.

In his breakout session,Javedwill dive into the real opportunity behind agentic AI. Yes, there’s plenty of hype — but for good reason. As he’ll explain, agentic AI enables more proactive decision-making and faster, more efficient responses to customer concerns, business opportunities, and operational challenges.

For small businesses with limited resources, agentic AI offers significant benefits. In his session, Javed will outline how it’s already being scoped, validated, and implemented — giving you a blueprint to deploy it within your own business or those you support or fund.

Tkxel helps small businesses, startups, and enterprise organizations harness AI to scale. They’ve already partnered with high-profile clients like Barclays, Honeywell, NBC Universal, andMoment.AI— all with a hands-on approach championed by Javed, who brings that same focus to building teams and culture within Tkxel itself.

That’s exactly the mindset we’re bringing toTC Sessions: AI. While the field is full of bold predictions, we’re focused on practical solutions and real use cases — the kind that can drive immediate business impact or inspire your next big idea.

With tickets currently up to $300 off, there’s no better time to block your calendar, grab a ticket (or two!), and head to Berkeley for one of the year’s most exciting AI events.Lock in your low ticket ratesbefore they spike at the door on June 5."
Technical,"Apple’s Self Service Repair program is expanding to the iPad, the tech giantannouncedon Wednesday. The program will give iPad owners the tools they need to repair their devices at home. They can get access to repair manuals, genuine Apple parts, Apple Diagnostics troubleshooting sessions, tools, and rental toolkits.

Starting Thursday, users who have an iPad Air (M2 and later), iPad Pro (M4), iPad mini (A17 Pro), and iPad (A16) can order repair kits and components, including displays, batteries, cameras, and external charging ports.

“At Apple, our goal is to create the world’s greatest products that last as long as possible,” said Brian Naumann, Apple’s vice president of AppleCare, in a press release. “With today’s announcement, we’re excited to expand our repair services to more customers, enabling them to further extend the life of their products — all without compromising safety, security, or privacy.”

Launched in 2022, Self Service Repair allows consumers to do their own repairs at home if they’re comfortable doing so by getting access to the same manuals used at Apple Store locations and Apple Authorized Service Providers.

Apple says the program now supports 65 Apple products, including the recently released iPhone 16e, MacBook Air, and Mac Studio. The company shared that Canada will soon become the 34th country where Apple offers Self Service Repair.

Apple also revealed more details about its Genuine Parts Distributor program, which allows independent mobile repair professionals to order genuine Apple service parts and components. These parts are available via authorized third-party distributors, such as MobileSentrix in the U.S., plus MobileSentrix and Mobileparts.shop in Europe. Genuine Parts Distributor offers many Apple parts for iPhone repairs, including displays, batteries, and charging ports, with iPad parts coming tomorrow."
Technical,"Telegram has struck a partnership with Elon Musk’s AI company, xAI, to distribute the latter’s chatbot, Grok, via Telegram and integrate it into apps available on the chat app’s platform for one year.

xAI will pay $300 million in cash and equity to the chat app as part of the deal, Telegram’s CEO Pavel Durovsaidon Tuesday.

Durov said Telegram will also earn 50% of the revenue from xAI subscriptions purchased through the app.

Earlier this year, xAI made the Grok chatbot available toTelegram’s premium users. It seems Grok might now be made available to all users.

A video posted by Durov on X suggested that Grok can be pinned on top of chats within the app, and users can also ask questions to Grok from the search bar. Notably, Meta has also integrated Meta AI intothe search bar on Instagram and WhatsApp.

The video also shows that you will be able to use Grok for writing suggestions, summarizing chats, links, and documents, and creating stickers. Grok will supposedly also help answer questions for businesses and assist with moderation.

Note: This story was corrected to clarify that xAI is paying Telegram $300 million for distributing Grok."
Technical,"Instacart announced on Wednesday that its chief business officer, Chris Rogers, has been appointed as the company’s new CEO. The appointment is effective August 15. Rogers will also join Instacart’s board of directors.

The announcement comes a few weeks after Instacart CEOFidji Simoshared that she’s stepping down tojoin OpenAI as CEO of Applications. Simo will remain chair of the board at Instacart.

In his role as chief business officer, Rogers oversaw Instacart’s retailer relationships and expansions, Ad Sales and R&D, Partnerships, Mergers & Acquisitions, Instacart Business, and Instacart Health.

Rogers joined Instacart in 2019 after nearly 11 years at Apple, where he served as the managing director for Apple Canada. He began his career at Procter & Gamble, where he led relationships with Canada’s largest national grocery retailers, Instacart says.

“Instacart sits at the center of how people shop, eat, and care for their families — and that’s always been what inspires me most about our mission,” Rogers said in apress release. “Together with our partners, we’re transforming the future of grocery shopping, but more importantly, we’re helping people solve real, everyday needs. We have a world-class team, deep partnerships, leading technology, and a bold vision for the future, and I’m honored to step in and lead Instacart’s next chapter.”

In ablog post, Rogers said that Instacart’s vision will remain the same under his leadership, and that the company will continue to focus on its “unwavering commitment to growing the pie for retailers and brands.” He also said that Instacart will work to provide more flexible earnings opportunities for shoppers on its platform.

In a letter to employees, Simo stated that Rogers has played a critical role in shaping Instacart and that she will continue to work with him over the coming months to allow for a smooth transition.

“We chose Chris because the company needs a leader who understands all our partners deeply, has immense operational experience, and can mobilize teams around our vision,” Simo wrote. “Chris knows this company. He helped shape it. And I know Chris will carry our mission forward with conviction, care, and ambition. I couldn’t be more excited for him to step into the role of CEO and lead Instacart’s next phase of growth.”"
Technical,"Tech companies arebetting heavilythat nuclear power can help deliver the electricity they need to realize their AI plans. But data centers need power tomorrow, and the nuclear industry isn’t known for its speed.

Trey Lauderdale thinks AI can give nuclear the speed that it needs.

Lauderdale’s obsession with nuclear started close to home. In San Luis Obispo, California, where he lives, he kept running into people who worked at the Diablo Canyon Power Plant. “They’re like the coaches of our flag football team,” he said.

In talking with them, he learned that nuclear power plants are swimming in documents. Diablo Canyon has around 2 billion pages’ worth, he said. Lauderdale, a serial healthcare entrepreneur, had a hunch that AI could help the nuclear industry tame its paper problem.

Lauderdale foundedAtomic Canyona little over a year and a half ago, initially funding it with his own money. The startup uses AI to help engineers, maintenance technicians, and compliance officers find the documents they need.

The startup landed a deal with Diablo Canyon in late 2024. Lauderdale said the deal led to inquiries from other nuclear power companies. “That’s when I knew, as an entrepreneur, we were at a point where we needed to raise a round of capital.”

Atomic Canyon closed a $7 million seed round led by Energy Impact Partners, the company exclusively told TechCrunch. Participating investors include Commonweal Ventures, Plug and Play Ventures, Tower Research Ventures, Wischoff Ventures, and previous angel investors.

When Atomic Canyon first started, its AI engineers tested various models with underwhelming results. “We quickly realized the AI hallucinates when it sees these nuclear words,” Lauderdale said. “It hasn’t seen enough examples of the acronyms.”

But building a new AI model requires massive computing power. So Lauderdale talked his way into a meeting with Oak Ridge National Laboratory, which conducts nuclear research and also happens to have the world’s second-fastest supercomputer. The lab was intrigued by the idea and awarded Atomic Canyon 20,000 GPU hours’ worth of compute.

Atomic Canyon’s models use sentence embedding, which is particularly suited to indexing documents. It tasks them with making a nuclear power plant’s documents searchable using retrieval-augmented generation, or RAG. RAG uses large language models to create responses to queries, but it requires the LLMs to refer to specific documents in an effort to reduce hallucination.

For now, Atomic Canyon is sticking to document search, in part because the stakes are lower.

“One of the reasons we’re starting generative work around the titles of documents is because getting that wrong might cause someone a little frustration. It doesn’t put anyone at risk at the plant,” Lauderdale said.

Eventually, Lauderdale envisions Atomic Canyon’s AI creating “a first round draft” of documents, complete with references. “You are always going to have a human in the loop here,” he said.

Lauderdale didn’t put a timeline on that effort, though. Search is “the foundational layer,” he said. “You have to nail the search.” Plus, given the number of documents in the nuclear industry, “we have a long runway in search alone,” he said."
Technical,"Elon Musk’s brain implant startup, Neuralink, has raised $600 million in a funding round that values the company at $9 billion pre-money,Semafor reported, citing anonymous sources.

Semafor did not mention the investors involved in the round. Neuralink lastraised $43 millionin venture capital in November 2023, and was valued at about $5 billion in June 2023, Reutersreportedat the time.

Neuralink did not immediately return requests for comment outside regular business hours.

Semafor’s report corroborates earlier reportingfrom Bloomberg, which noted in April that the startup was looking to raise $500 million at an $8.5 billion pre-money valuation.

Neuralink last yearreceived “breakthrough device” clearancefrom the U.S. FDA. Three people have so far received implants made by Neuralink. Earlier this month, a nonverbal patientposted a videoabout how he uses a Neuralink implant to edit and narrate YouTube videos with just his brain signals."
Technical,"All Thibault Launay and his wife, Simi, wanted nearly five years ago was to build a dream home in Portugal, where they both now live.

But what they encountered instead was a broken system. “Fourteen months of delays, 20% budget overruns, and endless stress managing over 10 subcontractors,” Thibault recalled. They bought the land in December 2020, got the construction license in early 2022, and started building that year. “That was supposed to finish in February 2024,” he said. But it’s May 2025, and the home still isn’t done.

“We realized,” he continued, “if we’re struggling with this, so are millions of others.”

So Thibault, himself a serial founder and entrepreneur, and Simi, a consultant and also a founder, launchedLitehaus, a company that touts to help landowners and property developers build homes in a more efficient and sustainable way. It tackles a pressing need in both the U.S. and the European markets: the ability to build affordable homes.

Litehaus, which launched early last year, calls itself the “Uber of construction,” with Thibault saying the company just wants to connect all the currently fragmented parts of the home-building process. It matches landowners and property developers with other professionals such as construction companies, architects, contractors, and interior designers. The company allows users to track costs, coordinate schedules with the hired workers, and track the progress of the building in real time.

“As a go-to-market strategy, we decided to focus mainly on modular construction, allowing us to build 30% cheaper, 40% faster, and 60% more sustainably,” Thibault said, adding that meant 90% less waste and 50% less CO2 emissions compared with traditional construction.

Others in the modular construction space include the U.S.-based Ginosko Modular and Flummerfelt and the India-based Schnelle Prefabs, according to PitchBook.

Litehaus has at least one U.S. construction company in its network as it looks to further its expansion in the country. Right now, it is focused on becoming “Europe’s fastest-growing construction tech startup,” Thibault said.

Plus, the European construction industry could use more innovation. Investors in America pour billions of dollars into rising construction technology, and, as usual, there is much room for the European tech industry to catch up.

Investors here and across the pond clearly agree. Last week, Litehaus announced a €1.46 million pre-seed round, co-led by the U.K.’s Cornerstone VC and Explorer Fund, one of Portugal’s largest private equity funds. Claster Group, a Luxembourgish family office, and angel investor Pascal Levy, a venture partner at Long Journey Ventures here in the U.S., also participated in the round.

“The shortage of housing across Europe has triggered a crisis, driving up the cost of living as home ownership becomes increasingly out of reach,” Rodney Appiah, a managing partner at Cornerstone VC, said. “When I first met Thibault and Simi, I was struck by their compelling vision: to make building a home as simple as buying one, catalyzing the construction industry to bring greater transparency, sustainability, quality, and trust to the home-building process.”

Thibault called the fundraising journey “intense.” He said he and Simi had known their lead investors for years through mutual friends. Thibault, who is from France, is the founder of an immersive gaming studio in Portugal, but he has also invested in numerous companies, both as an angel investor and through his work at firms 50 Partners and Origins, based in France and New York, respectively. Before that, he worked at a French mining company and in green tech.

Simi, meanwhile, was born in Nigeria and grew up in London. She ran a contemporary art gallery, a wellness brand for women of color, and worked as a consultant and strategist for various firms on law and Africa.

“I’ve always wanted to build businesses that change people’s lives,” Simi told TechCrunch. “Providing affordable homes at scale isn’t just a market opportunity — it’s one of the most meaningful ways we can create deep, lasting impact.”

She is now in charge of marketing, communication, and design at Litehaus, while Thibault handles fundraising, business development, and tech.

“When it came time to raise, we moved quickly with partners who already knew us and shared our vision from day one,” Thibault said. He said the fresh capital will be used to help scale the company and hire more talent in engineering, product, marketing, and operations.

It’s quite funny that Thibault and Simi built a company, raised over a million euros, and had two kids, before their home, a process they started working on over four years ago, was finally finished.

“We are actually moving in next month,” Thibault said. “We move in next month after a 14-month delay on completion. This is the pain point we are trying to solve for millions of people.”

This story was updated to reflect who co-led the round."
